BDI/000215	Projetct for Infectious Diseases Prevention for children in the Republic of Burundi (UNICEF)	Projetct for Infectious Diseases Prevention for children in the Republic of Burundi (UNICEF)			Belgique; Japan International Cooperation Agency (JICA)	Belgique; Japon	Non spécifié	Non spécifié	Non spécifié	Non	SANTE	Santé de base
BDI/000216	Projet de promotion de l'énergie propre en utilisant le Système Solaire photovoltaïque	Project to promote clean energy using photovoltaic solar system			Japan International Cooperation Agency (JICA)	Japon	Ouest	Mairie de Bujumbura	Non spécifié	Non	PRODUCTION ET DISTRIBUTION D’ENERGIE	Énergie solaire
BDI/000217	Projet Réhabilitation du transport Public (Coopération technique)	Rehabilitation of Public (Technical Cooperation) transportation project			Japan International Cooperation Agency (JICA)	Japon	Sud; Ouest; Centre-Est; Nord	Kayanza; Muyinga; Ngozi; Cankuzo; Bubanza; Rutana; Mwaro; Kirundo; Muramvya; Bujumbura Rural; Mairie de Bujumbura; Ruyigi; Bururi; Makamba; Gitega; Cibitoke; Karuzi	Non spécifié	Oui	TRANSPORTS ET ENTREPOSAGE	Politique des transports et gestion administrative
BDI/000218	Appui au acteurs non étatiques et autorités locales (ANEAL)	Support to non-state actors and local authorities (Aneal)			Commission de l'Union Européenne	Commission de l'Union Européenne	Sud; Ouest; Centre-Est; Nord	Kayanza; Muyinga; Ngozi; Cankuzo; Bubanza; Rutana; Mwaro; Kirundo; Muramvya; Bujumbura Rural; Mairie de Bujumbura; Ruyigi; Bururi; Makamba; Gitega; Cibitoke; Karuzi	Non spécifié	Oui	GOUVERNEMENT ET SOCIETE CIVILE	Gouvernement et société civile, général
BDI/000219	Instrument Européen pour la Démocratie et les Droits de l'Homme	European Instrument for Democracy and Human Rights			Commission de l'Union Européenne	Commission de l'Union Européenne	Sud; Ouest; Centre-Est; Nord	Kayanza; Muyinga; Ngozi; Cankuzo; Bubanza; Rutana; Mwaro; Kirundo; Muramvya; Bujumbura Rural; Mairie de Bujumbura; Ruyigi; Bururi; Makamba; Gitega; Cibitoke; Karuzi	Non spécifié	Oui	GOUVERNEMENT ET SOCIETE CIVILE	Droits de la personne
BDI/000220	Facilité Alimentaire	Food Facility			Commission de l'Union Européenne	Commission de l'Union Européenne	Sud; Ouest; Centre-Est; Nord	Kayanza; Muyinga; Ngozi; Cankuzo; Bubanza; Rutana; Mwaro; Kirundo; Muramvya; Bujumbura Rural; Mairie de Bujumbura; Ruyigi; Bururi; Makamba; Gitega; Cibitoke; Karuzi	Non spécifié	Oui	AGRICULTURE	Développement agricole
BDI/000221	Programme Thématique Sécurité Alimentaire - LRRD	Food Security Thematic Programme - LRRD			Commission de l'Union Européenne	Commission de l'Union Européenne	Ouest; Centre-Est; Nord	Kayanza; Muyinga; Ngozi; Cankuzo; Bubanza; Kirundo; Muramvya; Bujumbura Rural; Ruyigi; Gitega; Cibitoke; Karuzi	Non spécifié	Non	AGRICULTURE	Production agricole
BDI/000222	Construction et bitumage de la RN19	Construction and asphalting of the RN19			Commission de l'Union Européenne	Commission de l'Union Européenne	Centre-Est; Nord	Muyinga; Cankuzo	Non spécifié	Non	TRANSPORTS ET ENTREPOSAGE	Transport routier
BDI/000223	Réhabilitation de la RN4	Rehabilitation of the N4			Commission de l'Union Européenne	Commission de l'Union Européenne	Ouest	Bujumbura Rural	Non spécifié	Non	TRANSPORTS ET ENTREPOSAGE	Transport routier
BDI/000224	Projet d'appui à l'intégration régionale (PAIR)	Support regional integration (PAIR) project		Faciliter l'intégration régionale du Burundi dans l'EAC et dans le COMESA et la mise en œuvre de l'APE,	Commission de l'Union Européenne	Commission de l'Union Européenne	Sud; Ouest; Centre-Est; Nord	Kayanza; Muyinga; Ngozi; Cankuzo; Bubanza; Rutana; Mwaro; Kirundo; Muramvya; Bujumbura Rural; Mairie de Bujumbura; Ruyigi; Bururi; Makamba; Gitega; Cibitoke; Karuzi	Non spécifié	Oui	GOUVERNEMENT ET SOCIETE CIVILE	Politique / planification économique et du développement
BDI/000225	Facilité de Coopération Technique (FCT 10ème FED)	Technical Cooperation Facility (TCF 10th EDF)		Exécuter et évaluer les actions sous le programme indicatif du 10ème FED et sensibiliser les acteurs clés sur les questions clés de développement et les procédures UE par le biais de la formation et de l'Assistance technique,	Commission de l'Union Européenne	Commission de l'Union Européenne	Sud; Ouest; Centre-Est; Nord	Kayanza; Muyinga; Ngozi; Cankuzo; Bubanza; Rutana; Mwaro; Kirundo; Muramvya; Bujumbura Rural; Mairie de Bujumbura; Ruyigi; Bururi; Makamba; Gitega; Cibitoke; Karuzi	Non spécifié	Oui	GOUVERNEMENT ET SOCIETE CIVILE	Gouvernement et société civile, général
BDI/000226	Projet d'appui à la politique sectorielle de la santé au Burundi (PAPSBU)	Support sectoral health policy project in Burundi (PAPSBU)			Commission de l'Union Européenne	Commission de l'Union Européenne	Sud; Ouest; Centre-Est; Nord	Kayanza; Muyinga; Ngozi; Cankuzo; Bubanza; Rutana; Mwaro; Kirundo; Muramvya; Bujumbura Rural; Mairie de Bujumbura; Ruyigi; Bururi; Makamba; Gitega; Cibitoke; Karuzi	Non spécifié	Oui	SANTE	Santé de base
BDI/000227	Organisations de la société civile: Appui et renforcement (OSCAR)	Civil society support and capacity (OSCAR)		Appui à la participation des ANE aux processus de consolidation de la paix d'une part et aux processus d’élaboration, de mise en œuvre et de suivi des politiques de développement d'autre part.	Commission de l'Union Européenne	Commission de l'Union Européenne	Sud; Ouest; Centre-Est; Nord	Kayanza; Muyinga; Cankuzo; Muramvya; Ruyigi; Makamba; Cibitoke	Non spécifié	Non	GOUVERNEMENT ET SOCIETE CIVILE	Gouvernement et société civile, général
BDI/000228	Assistance agricoles  d’urgence aux populations vulnérables affectées par les aléas climatiques.	Agricultural Assistance Emergency vulnerable populations affected by climate hazards.			Banque Africaine de Développement	Banque Africaine de Développement	Non spécifié	Non spécifié	Non spécifié	Non	AGRICULTURE	Production agricole
BDI/000229	Assistance agricole d’urgence aux populations vulnérabilisées par le conflit et en phase de réinstallation et/ou réinsertion (rapatriés, refoulés et déplacés internes) sur leurs anciennes ou nouvelles terres.	Agricultural emergency assistance to vulnerable by conflict and resettlement phase and / or reintegration (returnees, deportees and IDPs) to their former lands or new populations.			Banque Africaine de Développement	Banque Africaine de Développement	Non spécifié	Non spécifié	Non spécifié	Non	AGRICULTURE	Production agricole
BDI/000230	Assistance to the restoration of food security and livelihoods through the provision of agricultural inputs and technical support to returnee households and their host communities in the eastern provinces of Burundi.	Assistance to the restoration of food security and livelihoods through the provision of agricultural inputs and technical support to returnee households and their host communities in the eastern provinces of Burundi.			Japon	Japon	Centre-Est	Cankuzo; Ruyigi; Karuzi	Non spécifié	Non	AGRICULTURE	Production agricole
BDI/000231	OSRO/RAF/808/SWE   Regional response to Food Insecurity, HIV, and GBV          in Eastern Africa	OSRO/RAF/808/SWE   Regional response to Food Insecurity, HIV, and GBV          in Eastern Africa			Ministère des affaires étrangères de la Suède	Suède	Non spécifié	Non spécifié	Non spécifié	Non	AIDE-PROGRAMME ET AIDE SOUS FORME DE PRODUITS; SANTE	Aide alimentaire à des fins de développement/aide à la sécurité alimentaire; Santé, général
BDI/000232	Amélioration des productions et des productivités agricoles pour  les populations retournées ou en cours de réinstallation.	Improving agricultural production and productivity for populations returned or being resettled.			Spanish Agency for International Cooperation (AECI)	Espagne	Non spécifié	Non spécifié	Non spécifié	Non	AGRICULTURE	Production agricole
BDI/000233	Appui à la recapitalisation des ménages vulnérables affectés par  la crise à travers le repeuplement du cheptel.	Support the recapitalization of vulnerable households affected by the crisis through the restocking of hives.			Spanish Agency for International Cooperation (AECI)	Espagne	Non spécifié	Non spécifié	Non spécifié	Non	AGRICULTURE	Bétail
BDI/000234	Appui à la réintégration rapide des ménages retournés dans  leurs communautés d'accueil dans les provinces de Bururi,  Makamba, Rutana, Ruyigi, Cankuzo et Muyinga.	Support the rapid reintegration of returnee households in their host communities in the provinces of Bururi  Makamba, Rutana, Ruyigi, Cankuzo and Muyinga.			Ministère des affaires étrangères de la Suède	Suède	Non spécifié	Non spécifié	Non spécifié	Non	AIDE HUMANITAIRE	Assistance matérielle et services d’urgence
BDI/000235	Assistance agricole d'urgence aux populations en phase de réinstallation/réinsertion (rapatriés, déplacés internes et ex-combattants) sur leurs anciennes ou nouvelles terres, et aux ménages vulnérabilisées par les récents aléas climatiques	Emergency agricultural assistance to populations in phase resettlement / reintegration (returnees, IDPs and ex-combatants) on their old and new lands, and households vulnerable by recent weather conditions			Belgique	Belgique	Sud; Ouest; Centre-Est; Nord	Kayanza; Muyinga; Ngozi; Cankuzo; Bubanza; Rutana; Mwaro; Kirundo; Muramvya; Bujumbura Rural; Mairie de Bujumbura; Ruyigi; Bururi; Makamba; Gitega; Cibitoke; Karuzi	Non spécifié	Oui	AIDE HUMANITAIRE	Intervention d’urgence
BDI/000236	Integrated response to the food and nutritional crisis in the Burundi’  provinces of Kirundo, Cankuzo and Ruyigi	Integrated response to the food and nutritional crisis in the Burundi’  provinces of Kirundo, Cankuzo and Ruyigi			OCHA	Nations Unies	Centre-Est; Nord	Cankuzo; Kirundo; Ruyigi	Non spécifié	Non	AIDE HUMANITAIRE	Intervention d’urgence
BDI/000237	Projet de sécurité alimentaire en appui aux populations rurales  et périurbaines vulnérables ainsi qu'au système  d'alerte précoce et de surveillance de la sécurité  alimentaire au Burundi	Food security project to support rural populations and peri vulnerable as well as system early warning and security monitoring Food in Burundi			Organisation des Nations Unies pour l'alimentation et l'agriculture	Nations Unies	Non spécifié	Non spécifié	Non spécifié	Non	AGRICULTURE	Production agricole
BDI/000238	Appui à la stabilisation des structures associatives communautaires de production et de conservation de semences et matériel végétal de qualité.	Support stabilization Community associative structures of production and conservation of seeds and plant material quality.			Belgique	Belgique	Non spécifié	Non spécifié	Non spécifié	Non	AGRICULTURE	Production agricole
BDI/000239	Intervention agricole d’urgence en appui à la réinsertion et à la réintégration des rapatriées.	Agricultural Emergency Response to support the rehabilitation and reintegration of returnees.			OCHA	Nations Unies	Non spécifié	Non spécifié	Non spécifié	Non	AGRICULTURE	Production agricole
BDI/000240	Assistance technique dans l`approche "Livestock Farmer Field Schools	Technical assistance in the `" Livestock Farmer Field Schools approach			Banque Africaine de Développement	Banque Africaine de Développement	Non spécifié	Non spécifié	Non spécifié	Non	AGRICULTURE	Développement agricole
BDI/000241	Intervention d’urgence en appui des moyens de vie des ménages  les plus vulnérables affectés par la crise alimentaire	Emergency support livelihoods of the most vulnerable households affected by the food crisis response			OCHA	Nations Unies	Non spécifié	Non spécifié	Non spécifié	Non	AIDE-PROGRAMME ET AIDE SOUS FORME DE PRODUITS	Programmes de sécurité et d’aide alimentaire
BDI/000242	Plan d'action commun d'appui aux médias	Media support for common action plan			Department for International Development (DFID)	Royaume-Uni	Non spécifié	Non spécifié	Non spécifié	Non	COMMUNICATIONS	Radio, télévision, presse écrite
BDI/000243	Fonds de réserve pour l'appui aux éléctions	Reserve Fund support for elections			Department for International Development (DFID)	Royaume-Uni	Non spécifié	Non spécifié	Non spécifié	Non	GOUVERNEMENT ET SOCIETE CIVILE	Élections
BDI/000244	Conseiller au processus électoral	Advise the electoral process			Department for International Development (DFID)	Royaume-Uni	Non spécifié	Non spécifié	Non spécifié	Non	GOUVERNEMENT ET SOCIETE CIVILE	Gouvernement et société civile, général
BDI/000245	Contribution aux fonds communpour l'appui aux élections 2010	Contribution to communpour election support fund 2010			Department for International Development (DFID)	Royaume-Uni	Non spécifié	Non spécifié	Non spécifié	Non	GOUVERNEMENT ET SOCIETE CIVILE	Gouvernement et société civile, général
BDI/000246	Soutien à l'amélioration de la gouvernance à l'école primaire	Support for improved governance in primary school			Department for International Development (DFID)	Royaume-Uni	Ouest; Nord	Kayanza; Muramvya	Non spécifié	Non	EDUCATION	Éducation de base
BDI/000247	Enquête démographique et de santé	Demographic and Health Survey			Department for International Development (DFID)	Royaume-Uni	Non spécifié	Non spécifié	Non spécifié	Non	SANTE	Santé, général
BDI/000248	Aide financière à la CAMEBU	Financial assistance to CAMEBU			Department for International Development (DFID)	Royaume-Uni	Non spécifié	Non spécifié	Non spécifié	Non	SANTE	Santé, général
BDI/000249	Appui à l'éducation primaire	Support to Primary Education			Department for International Development (DFID)	Royaume-Uni	Non spécifié	Non spécifié	Non spécifié	Non	EDUCATION	Enseignement primaire
BDI/000250	Contribution au programme annuel de CICR Burundi 2009 et 2010	Contribution to the annual program ICRC Burundi 2009 and 2010			Department for International Development (DFID)	Royaume-Uni	Non spécifié	Non spécifié	Non spécifié	Non	AIDE HUMANITAIRE	Intervention d’urgence
BDI/000251	Assistance agricole d’urgence aux populations vulnérabilisées par le conflit et en phase de réinstallation et/ou réinsertion (rapatriés, refoulés et déplacés internes) sur leurs anciennes ou nouvelles terres	Agricultural emergency assistance to vulnerable by conflict and resettlement phase and / or reintegration (returnees, deportees and IDPs) to their former lands or new populations			Belgique	Belgique	Non spécifié	Non spécifié	Non spécifié	Non	AGRICULTURE	Produits à usage agricole
BDI/000252	Appui à la restauration des capacités de production et à la réinsertion socioéconomique des ménages retournés dans les provinces de Ruyigi,  Rutana, Makamba etBururi	Support restoration capabilities production and socio-economic reintegration households returned Ruyigi, Rutana, Makamba etBururi			Organisation des Nations Unies pour l'alimentation et l'agriculture	Nations Unies	Sud; Centre-Est	Rutana; Ruyigi; Bururi; Makamba	Non spécifié	Non	AGRICULTURE	Production agricole
BDI/000253	ACP-UE Water facility firt global commitement on decision of 247 meur-N+1 applies	ACP-UE Water facility firt global commitement on decision of 247 meur-N+1 applies			Commission de l'Union Européenne	Commission de l'Union Européenne	Non spécifié	Non spécifié	Non spécifié	Non	DISTRIBUTION D’EAU ET ASSAINISSEMENT	Distribution d’eau et assainissement – systèmes à grande échelle
BDI/000254	Appui à la Décentralisation et Lutte contre la Pauvreté, ADLP	Decentralization Support and Fight against Poverty ADLP			Allemagne	Allemagne	Sud; Centre-Est	Mwaro; Gitega	Non spécifié	Non	GOUVERNEMENT ET SOCIETE CIVILE	Administration gouvernementale
BDI/000255	Energising Developement (EnDev2) Burundi	Energising Developement (EnDev2) Burundi			Allemagne	Allemagne	Sud; Ouest; Centre-Est; Nord	Kayanza; Muyinga; Ngozi; Cankuzo; Bubanza; Rutana; Mwaro; Kirundo; Muramvya; Bujumbura Rural; Mairie de Bujumbura; Ruyigi; Bururi; Makamba; Gitega; Cibitoke; Karuzi	Non spécifié	Oui	PRODUCTION ET DISTRIBUTION D’ENERGIE	Énergie solaire
BDI/000256	Protection et assistance aux rapatriés, réfugiés et demandeurs d'asile.	Protection and assistance to returnees, refugees and asylum seekers.			Belgique; Haut Commissariat des Nations Unies pour les Réfugiés	Belgique; Nations Unies	Sud; Ouest; Centre-Est; Nord	Kayanza; Muyinga; Ngozi; Cankuzo; Bubanza; Rutana; Mwaro; Kirundo; Muramvya; Bujumbura Rural; Mairie de Bujumbura; Ruyigi; Bururi; Makamba; Gitega; Cibitoke; Karuzi	Non spécifié	Oui	AIDE HUMANITAIRE	Intervention d’urgence
BDI/000257	Facilités des Etas Fragiles      "FEF"	Facilities ETAS Fragile "FSF"			Banque Africaine de Développement	Banque Africaine de Développement	Sud; Ouest; Centre-Est; Nord	Kayanza; Muyinga; Ngozi; Cankuzo; Bubanza; Rutana; Mwaro; Kirundo; Muramvya; Bujumbura Rural; Mairie de Bujumbura; Ruyigi; Bururi; Makamba; Gitega; Cibitoke; Karuzi	Non spécifié	Oui	GOUVERNEMENT ET SOCIETE CIVILE	Politique / planification économique et du développement
BDI/000258	Développement d’Horticulture Urbaine et Péri-urbaine au Burundi	Development of Urban Horticulture and Peri-urban to Burundi			Belgique	Belgique	Ouest	Bubanza; Muramvya; Bujumbura Rural; Mairie de Bujumbura	Non spécifié	Non	AGRICULTURE	Récoltes destinées à l’exportation
BDI/000259	Improvement of food security in cross-border districts of Burundi, Rwanda and Uganda, in support of the modernization of agriculture under NEPAD framework	Improvement of food security in cross-border districts of Burundi, Rwanda and Uganda, in support of the modernization of agriculture under NEPAD framework			Organisation des Nations Unies pour l'alimentation et l'agriculture	Nations Unies	Nord	Kayanza; Ngozi; Kirundo	Non spécifié	Non	AGRICULTURE	Politique agricole et gestion administrative
BDI/000260	Appui à la gestion durable des peuplements d’eucalyptus et de punis et au partage équitable des bénéfices	Support the sustainable management of eucalyptus stands and punished and equitable sharing of benefits			Organisation des Nations Unies pour l'alimentation et l'agriculture	Nations Unies	Sud; Ouest	Bujumbura Rural; Bururi	Non spécifié	Non	AGRICULTURE	Développement agricole alternatif
BDI/000261	Projet de fourniture des médicaments	Project to supply drugs			Ambassade de Chine	Chine	Sud; Ouest; Centre-Est; Nord	Kayanza; Muyinga; Ngozi; Cankuzo; Bubanza; Rutana; Mwaro; Kirundo; Muramvya; Bujumbura Rural; Mairie de Bujumbura; Ruyigi; Bururi; Makamba; Gitega; Cibitoke; Karuzi	Non spécifié	Oui	SANTE	Services médicaux
BDI/000262	Mise en place d'un centre de prévention et de traitement du paludisme	Establishment of a center for the prevention and treatment of malaria			Ambassade de Chine	Chine	Ouest	Mairie de Bujumbura	Non spécifié	Non	SANTE	Santé, général
BDI/000263	Réhabilitation de la Route d'accès à la Centrale Hydroélectrique de Mugere	Rehabilitation of Access Road Hydroelectric Plant Mugere			Ambassade de Chine	Chine	Ouest	Bujumbura Rural	Non spécifié	Non	TRANSPORTS ET ENTREPOSAGE	Transport routier
BDI/000264	Construction de l'Hôpital Mpanda	Construction of Mpanda Hospital			Ambassade de Chine	Chine	Ouest	Bujumbura Rural	Non spécifié	Non	SANTE	Santé, général
BDI/000265	Appuyer les communautés pour les élections	Support communities for elections			United States Agency for International Development	États Unis d'Amérique	Ouest	Bujumbura Rural; Mairie de Bujumbura	Non spécifié	Non	GOUVERNEMENT ET SOCIETE CIVILE	Gouvernement et société civile, général
BDI/000266	Overcoming barriers to peace building and reconciliation through multi-religious cooperation in Burundi	Overcoming barriers to peace building and reconciliation through multi-religious cooperation in Burundi			United States Agency for International Development	États Unis d'Amérique	Non spécifié	Non spécifié	Non spécifié	Non	GOUVERNEMENT ET SOCIETE CIVILE	Administration gouvernementale
BDI/000267	Building transformation project	Building transformation project			United States Agency for International Development	États Unis d'Amérique	Non spécifié	Non spécifié	Non spécifié	Non	GOUVERNEMENT ET SOCIETE CIVILE	Prévention et règlement des conflits, paix et sécurité
BDI/000268	Burundi policy reform	Burundi policy reform			United States Agency for International Development	États Unis d'Amérique	Non spécifié	Non spécifié	Non spécifié	Non	GOUVERNEMENT ET SOCIETE CIVILE	Gouvernement et société civile, général
BDI/000269	Child survival Program/Mabayi	Child survival Program/Mabayi			United States Agency for International Development	États Unis d'Amérique	Ouest	Cibitoke	Mabayi	Non	AIDE HUMANITAIRE	Aide alimentaire d’urgence
BDI/000270	South Carolina States-Ngozi University	South Carolina States-Ngozi University			United States Agency for International Development	États Unis d'Amérique	Nord	Kayanza; Ngozi	Non spécifié	Non	EDUCATION	Enseignement supérieur
BDI/000271	Child survival program/Kibuye	Child survival program/Kibuye			United States Agency for International Development	États Unis d'Amérique	Centre-Est	Gitega	Non spécifié	Non	AIDE HUMANITAIRE	Intervention d’urgence
BDI/000272	Planification familiale et violences basées sur le genre	Family planning and gender-based violence			United States Agency for International Development	États Unis d'Amérique	Centre-Est	Cankuzo; Ruyigi	Non spécifié	Non	GOUVERNEMENT ET SOCIETE CIVILE	Politique / planification économique et du développement
BDI/000273	Research component of the PM2A	Research component of the PM2A			United States Agency for International Development	États Unis d'Amérique	Sud; Ouest; Centre-Est; Nord	Kayanza; Muyinga; Ngozi; Cankuzo; Bubanza; Rutana; Mwaro; Kirundo; Muramvya; Bujumbura Rural; Mairie de Bujumbura; Ruyigi; Bururi; Makamba; Gitega; Cibitoke; Karuzi	Non spécifié	Oui	AIDE HUMANITAIRE	Reconstruction et réhabilitation
BDI/000274	Water development alliance	Water development alliance			United States Agency for International Development	États Unis d'Amérique	Ouest	Bujumbura Rural	Non spécifié	Non	DISTRIBUTION D’EAU ET ASSAINISSEMENT	Distribution d’eau potable de base et assainissement de base
BDI/000275	Prevention of malnutrition in under two's Approach (PM2A) :TUBARAMURE	Prevention of malnutrition in under two's Approach (PM2A) :TUBARAMURE		Prévention de la malnutrition aux moins de deux ans	Etats Unis d'Amérique	États Unis d'Amérique	Centre-Est	Cankuzo; Ruyigi	Non spécifié	Non	AIDE HUMANITAIRE	Reconstruction et réhabilitation
BDI/000276	Multi year assistance program	Multi year assistance program			United States Agency for International Development	États Unis d'Amérique	Nord	Kayanza; Muyinga; Kirundo	Non spécifié	Non	AGRICULTURE; SANTE	Développement agricole; Santé de base
BDI/000277	Burundi malaria program (bednets, case managment, technical assistance, ..)	Burundi malaria program (bednets, case managment, technical assistance, ..)			Etats Unis d'Amérique	États Unis d'Amérique	Sud; Ouest; Centre-Est; Nord	Kayanza; Muyinga; Ngozi; Cankuzo; Bubanza; Rutana; Mwaro; Kirundo; Muramvya; Bujumbura Rural; Mairie de Bujumbura; Ruyigi; Bururi; Makamba; Gitega; Cibitoke; Karuzi	Non spécifié	Oui	SANTE	Santé de base
BDI/000278	Roads to a healthy future	Roads to a healthy future			United States Agency for International Development	États Unis d'Amérique	Centre-Est; Nord	Kayanza; Muyinga; Kirundo; Karuzi	Non spécifié	Non	SANTE	Santé, général
BDI/000279	Advancing Women's Roles, Rights and Security for Peace Building in Burundi-1	Advancing Women's Roles, Rights and Security for Peace Building in Burundi-1			ONUFEMMES	Nations Unies	Non spécifié	Non spécifié	Non spécifié	Non	GOUVERNEMENT ET SOCIETE CIVILE	Gouvernement et société civile, général
BDI/000280	Support to Gender issues in the context of the Pact on Security, stability and development in the Great Lakes Region	Support to Gender issues in the context of the Pact on Security, stability and development in the Great Lakes Region			ONUFEMMES	Nations Unies	Non spécifié	Non spécifié	Non spécifié	Non	GOUVERNEMENT ET SOCIETE CIVILE	Droits de la personne
BDI/000281	Réhabilitation du Rôle de la femme dans le Processus de Réconciliation et de Reconstruction Communautaire	Rehabilitation of the role of women in the process of Reconciliation and Community Reconstruction			Fonds des Nations Unies pour la Consolidation de la Paix (FNUCP))	Nations Unies	Ouest	Bubanza; Bujumbura Rural; Mairie de Bujumbura; Cibitoke	Non spécifié	Non	DESTINATION  PLURI-SECTO-RIELLE OU TRANSVERSALE	Autres multi secteurs
BDI/000282	Advancing Women's Roles, Rights and Security for Peace Building in Burundi	Advancing Women's Roles, Rights and Security for Peace Building in Burundi			Norvège	Norvège	Non spécifié	Non spécifié	Non spécifié	Non	GOUVERNEMENT ET SOCIETE CIVILE	Droits de la personne; Organisations et institutions pour l’égalité des femmes
BDI/000283	Advancing Women’s Roles, Rights and Security for Peace Building in Burundi	Advancing Women’s Roles, Rights and Security for Peace Building in Burundi			DENMARK Ministry of Foreign Affairs	Danemark	Non spécifié	Non spécifié	Non spécifié	Non	GOUVERNEMENT ET SOCIETE CIVILE	Organisations et institutions pour l’égalité des femmes
BDI/000284	V-FLEX: Limiter l'impact de la crise financière et économique sur les pays ACP	V-FLEX: Limiting the impact of the financial and economic crisis on the ACP countries			Commission de l'Union Européenne	Commission de l'Union Européenne	Non spécifié	Non spécifié	Non spécifié	Non	AIDE-PROGRAMME ET AIDE SOUS FORME DE PRODUITS	Soutien budgétaire
